{
  "format": "tangram-puzzle/1",
  "id": "animals-cat",
  "title": {
    "en": "Cat",
    "fi": "Kissa"
  },
  "category": "animals",
  "difficulty": 2,
  "solution": [
    {"piece": "LT1", "polygon": [[0, 6], [4, 6], [2, 4]]},
    {"piece": "LT2", "polygon": [[4, 6], [4, 2], [2, 4]]},
    {"piece": "SQ", "polygon": [[2, 2], [3, 1], [4, 2], [3, 3]]},
    {"piece": "ST1", "polygon": [[2, 2], [3, 1], [2, 0]]},
    {"piece": "ST2", "polygon": [[3, 1], [4, 2], [4, 0]]},
    {"piece": "PG", "polygon": [[4, 6], [4, 4], [5, 3], [5, 5]]},
    {"piece": "MT", "polygon": [[0, 4], [0, 6], [2, 4]]}
  ],
  "art": {
    "base": "#F29E4C",
    "shapes": [
      {"type": "polygon", "points": [[2.15, 1.55], [2.7, 1.0], [2.15, 0.45]], "fill": "#F7C6A3"},
      {"type": "polygon", "points": [[3.3, 1.0], [3.85, 1.55], [3.85, 0.45]], "fill": "#F7C6A3"},
      {"type": "polygon", "points": [[0, 4], [0, 6], [2, 4]], "fill": "#FBE7D3"},
      {"type": "path", "d": "M3.3,3.35 Q3.7,3.55 4,3.35", "stroke": "#C8651F", "width": 0.16},
      {"type": "path", "d": "M3.0,4.05 Q3.5,4.3 4,4.05", "stroke": "#C8651F", "width": 0.16},
      {"type": "path", "d": "M2.8,4.85 Q3.4,5.1 4,4.85", "stroke": "#C8651F", "width": 0.16},
      {"type": "line", "from": [4, 4.75], "to": [5, 3.75], "stroke": "#C8651F", "width": 0.18},
      {"type": "line", "from": [4, 5.45], "to": [5, 4.45], "stroke": "#C8651F", "width": 0.18},
      {"type": "ellipse", "c": [2.65, 1.95], "rx": 0.1, "ry": 0.14, "fill": "#2B2D42"},
      {"type": "ellipse", "c": [3.35, 1.95], "rx": 0.1, "ry": 0.14, "fill": "#2B2D42"},
      {"type": "circle", "c": [2.68, 1.9], "r": 0.035, "fill": "#FFFFFF"},
      {"type": "circle", "c": [3.38, 1.9], "r": 0.035, "fill": "#FFFFFF"},
      {"type": "polygon", "points": [[2.88, 2.28], [3.12, 2.28], [3, 2.42]], "fill": "#D65A7A"},
      {"type": "line", "from": [2.7, 2.45], "to": [2.25, 2.3], "stroke": "#5A3A22", "width": 0.03},
      {"type": "line", "from": [3.3, 2.45], "to": [3.75, 2.3], "stroke": "#5A3A22", "width": 0.03},
      {"type": "ellipse", "c": [0.8, 5.88], "rx": 0.38, "ry": 0.16, "fill": "#FBE7D3"},
      {"type": "ellipse", "c": [1.7, 5.88], "rx": 0.38, "ry": 0.16, "fill": "#FBE7D3"}
    ]
  },
  "provenance": {
    "author": "ai:claude",
    "reviewedByHuman": false
  }
}
