{
  "format": "tangram-puzzle/1",
  "id": "shapes-warmup-4",
  "title": {
    "en": "Warm-up 4",
    "fi": "Lämmittely 4"
  },
  "category": "shapes",
  "difficulty": 1,
  "solution": [
    {"piece": "LT1", "polygon": [[4, 6], [0, 6], [2, 4]]},
    {"piece": "LT2", "polygon": [[2, 2], [6, 2], [4, 4]]},
    {"piece": "MT", "polygon": [[2, 2], [2, 0], [4, 2]]},
    {"piece": "SQ", "polygon": [[0, 4], [1, 3], [2, 4], [1, 5]]},
    {"piece": "PG", "polygon": [[4, 6], [4, 4], [3, 3], [3, 5]]},
    {"piece": "ST1", "polygon": [[6, 4], [4, 4], [5, 3]]},
    {"piece": "ST2", "polygon": [[2, 2], [2, 4], [1, 3]]}
  ],
  "art": {
    "base": "#F8961E",
    "shapes": [
      {"type": "circle", "c": [1.42, 0.62], "r": 0.54, "fill": "#FFFFFF", "opacity": 0.35},
      {"type": "circle", "c": [0.93, 0.4], "r": 0.54, "fill": "#FFFFFF", "opacity": 0.35},
      {"type": "circle", "c": [5.51, 4.8], "r": 0.76, "fill": "#FFFFFF", "opacity": 0.35},
      {"type": "circle", "c": [1.33, 3.22], "r": 0.47, "fill": "#FFFFFF", "opacity": 0.35},
      {"type": "circle", "c": [1.04, 0.64], "r": 0.43, "fill": "#FFFFFF", "opacity": 0.35},
      {"type": "circle", "c": [5.56, 4.97], "r": 0.78, "fill": "#FFFFFF", "opacity": 0.35},
      {"type": "circle", "c": [4.8, 1.16], "r": 0.49, "fill": "#FFFFFF", "opacity": 0.35},
      {"type": "line", "from": [0, 1.98], "to": [6.0, 0.98], "stroke": "#FFFFFF", "width": 0.18, "opacity": 0.5},
      {"type": "line", "from": [0, 4.2], "to": [6.0, 3.2], "stroke": "#FFFFFF", "width": 0.18, "opacity": 0.5}
    ]
  },
  "provenance": {
    "author": "ai:claude (generated by exposure search)",
    "reviewedByHuman": false
  }
}
