{
  "format": "tangram-puzzle/1",
  "id": "things-arrow",
  "title": {
    "en": "Arrow",
    "fi": "Nuoli"
  },
  "category": "things",
  "difficulty": 2,
  "kind": "full",
  "solution": [
    {"piece": "LT1", "polygon": [[4, 0], [4, 4], [6, 2]]},
    {"piece": "LT2", "polygon": [[0, 3], [4, 3], [2, 1]]},
    {"piece": "MT", "polygon": [[0, 1], [2, 1], [0, 3]]},
    {"piece": "ST1", "polygon": [[2, 1], [4, 1], [3, 2]]},
    {"piece": "ST2", "polygon": [[4, 1], [4, 3], [3, 2]]},
    {"piece": "SQ", "polygon": [[-2, 1], [-1, 0], [0, 1], [-1, 2]]},
    {"piece": "PG", "polygon": [[0, 1], [0, 3], [-1, 4], [-1, 2]]}
  ],
  "art": {
    "base": "#B07A4F",
    "shapes": [
      {"type": "line", "from": [0, 1.6], "to": [4, 1.6], "stroke": "#9A6640", "width": 0.05},
      {"type": "line", "from": [0, 2.4], "to": [4, 2.4], "stroke": "#9A6640", "width": 0.05},
      {"type": "polygon", "points": [[4, 0], [4, 4], [6, 2]], "fill": "#9AA5B1"},
      {"type": "polygon", "points": [[4, 0], [4, 2], [6, 2]], "fill": "#C3CCD5"},
      {"type": "polygon", "points": [[-2, 1], [-1, 0], [0, 1], [-1, 2]], "fill": "#E8505B"},
      {"type": "polygon", "points": [[0, 1], [0, 3], [-1, 4], [-1, 2]], "fill": "#E8505B"},
      {"type": "line", "from": [-1.5, 1.5], "to": [-0.5, 0.5], "stroke": "#FFFFFF", "width": 0.05},
      {"type": "line", "from": [-0.5, 3.5], "to": [-0.5, 1.5], "stroke": "#FFFFFF", "width": 0.05},
      {"type": "rect", "x": -0.05, "y": 1, "w": 0.35, "h": 2, "fill": "#3D2B1F"}
    ]
  },
  "provenance": {
    "author": "ai:claude",
    "reviewedByHuman": false
  }
}
