{
  "format": "tangram-puzzle/1",
  "id": "nature-tree",
  "title": {
    "en": "Tree",
    "fi": "Puu"
  },
  "category": "nature",
  "difficulty": 2,
  "kind": "full",
  "solution": [
    {"piece": "LT1", "polygon": [[4, 3], [0, 3], [2, 1]]},
    {"piece": "LT2", "polygon": [[5, 5], [1, 5], [3, 3]]},
    {"piece": "MT", "polygon": [[1, 0], [3, 0], [1, 2]]},
    {"piece": "PG", "polygon": [[4, 6], [2, 6], [1, 5], [3, 5]]},
    {"piece": "SQ", "polygon": [[0, 4], [1, 3], [2, 4], [1, 5]]},
    {"piece": "ST1", "polygon": [[1, 3], [3, 3], [2, 4]]},
    {"piece": "ST2", "polygon": [[3, 0], [3, 2], [2, 1]]}
  ],
  "art": {
    "base": "#2E8B57",
    "shapes": [
      {"type": "polygon", "points": [[1, 0], [2, 0.1], [1, 2]], "fill": "#4DB36F"},
      {"type": "polygon", "points": [[2, 1], [2, 3], [0, 3]], "fill": "#4DB36F"},
      {"type": "polygon", "points": [[3, 3], [3, 5], [1, 5]], "fill": "#4DB36F"},
      {"type": "polygon", "points": [[1, 3], [3, 3], [2, 4]], "fill": "#1F6B40"},
      {"type": "polygon", "points": [[3, 0], [3, 2], [2.4, 1.4]], "fill": "#1F6B40"},
      {"type": "line", "from": [0, 3], "to": [4, 3], "stroke": "#1F6B40", "width": 0.1},
      {"type": "line", "from": [1, 5], "to": [5, 5], "stroke": "#1F6B40", "width": 0.1},
      {"type": "polygon", "points": [[1, 5], [3, 5], [4, 6], [2, 6]], "fill": "#8B5A2B"},
      {"type": "polygon", "points": [[2.0, 0.35], [2.13, 0.67], [2.48, 0.7], [2.21, 0.92], [2.29, 1.25], [2.0, 1.07], [1.71, 1.25], [1.79, 0.92], [1.52, 0.7], [1.87, 0.67]], "fill": "#FFD54F"},
      {"type": "circle", "c": [1.4, 2.65], "r": 0.2, "fill": "#E53935"},
      {"type": "circle", "c": [3.1, 2.6], "r": 0.2, "fill": "#FFD54F"},
      {"type": "circle", "c": [2.1, 4.25], "r": 0.2, "fill": "#E53935"},
      {"type": "circle", "c": [3.9, 4.4], "r": 0.2, "fill": "#42A5F5"},
      {"type": "circle", "c": [1.6, 4.45], "r": 0.18, "fill": "#42A5F5"}
    ]
  },
  "provenance": {
    "author": "ai:claude",
    "reviewedByHuman": false
  }
}
