{
  "format": "tangram-puzzle/1",
  "id": "people-runner",
  "title": {
    "en": "Runner",
    "fi": "Juoksija"
  },
  "category": "people",
  "difficulty": 4,
  "kind": "full",
  "solution": [
    {"piece": "LT1", "polygon": [[4, 5], [0, 5], [2, 3]]},
    {"piece": "LT2", "polygon": [[4, 1], [4, 5], [2, 3]]},
    {"piece": "SQ", "polygon": [[4, 3], [5, 2], [6, 3], [5, 4]]},
    {"piece": "ST1", "polygon": [[0, 5], [2, 5], [1, 6]]},
    {"piece": "ST2", "polygon": [[4, 3], [4, 1], [5, 2]]},
    {"piece": "PG", "polygon": [[4, 4], [4, 6], [5, 7], [5, 5]]},
    {"piece": "MT", "polygon": [[5, 0], [5, 2], [3, 0]]}
  ],
  "art": {
    "base": "#E8505B",
    "shapes": [
      {"type": "polygon", "points": [[4, 5], [0, 5], [2, 3]], "fill": "#F4C7A1"},
      {"type": "polygon", "points": [[0, 5], [2, 5], [1, 6]], "fill": "#F7F4EC"},
      {"type": "polygon", "points": [[4, 3.6], [4, 5], [2.6, 5], [2.0, 3.7]], "fill": "#2F3E6B"},
      {"type": "polygon", "points": [[4, 4], [4, 6], [5, 7], [5, 5]], "fill": "#F4C7A1"},
      {"type": "polygon", "points": [[4, 5.6], [5, 6.6], [5, 7], [4, 6]], "fill": "#F7F4EC"},
      {"type": "polygon", "points": [[4, 4], [4, 4.9], [5, 5], [5, 5]], "fill": "#2F3E6B"},
      {"type": "polygon", "points": [[4, 3], [5, 2], [6, 3], [5, 4]], "fill": "#F4C7A1"},
      {"type": "line", "from": [3.0, 2.4], "to": [3.9, 1.5], "stroke": "#F7F4EC", "width": 0.15},
      {"type": "polygon", "points": [[5, 0], [5, 2], [3, 0]], "fill": "#F4C7A1"},
      {"type": "polygon", "points": [[3, 0], [5, 0], [5, 0.6], [4.2, 0.6], [3.6, 0.6]], "fill": "#5A3A22"},
      {"type": "circle", "c": [4.65, 0.95], "r": 0.07, "fill": "#2B2D42"}
    ]
  },
  "provenance": {
    "author": "ai:claude",
    "reviewedByHuman": false
  }
}
