{
  "format": "tangram-puzzle/1",
  "id": "animals-rabbit",
  "title": {
    "en": "Rabbit",
    "fi": "Kani"
  },
  "category": "animals",
  "difficulty": 3,
  "kind": "full",
  "solution": [
    {"piece": "LT1", "polygon": [[4, 7], [0, 7], [2, 5]]},
    {"piece": "LT2", "polygon": [[4, 3], [4, 7], [2, 5]]},
    {"piece": "SQ", "polygon": [[2, 3], [3, 2], [4, 3], [3, 4]]},
    {"piece": "ST1", "polygon": [[2, 3], [2, 1], [3, 2]]},
    {"piece": "ST2", "polygon": [[4, 5], [4, 3], [5, 4]]},
    {"piece": "PG", "polygon": [[3, 0], [3, 2], [4, 3], [4, 1]]},
    {"piece": "MT", "polygon": [[0, 5], [2, 5], [0, 7]]}
  ],
  "art": {
    "base": "#CFC4B6",
    "shapes": [
      {"type": "ellipse", "c": [2.2, 5.95], "rx": 1.35, "ry": 0.95, "fill": "#B8AB9B"},
      {"type": "ellipse", "c": [3.05, 4.75], "rx": 0.5, "ry": 0.6, "fill": "#F6F1E9"},
      {"type": "circle", "c": [4.45, 4.0], "r": 0.4, "fill": "#F6F1E9"},
      {"type": "polygon", "points": [[3.25, 0.7], [3.25, 2.0], [3.75, 2.5], [3.75, 1.2]], "fill": "#F2A0B5"},
      {"type": "polygon", "points": [[2.15, 1.6], [2.55, 2.0], [2.15, 2.4]], "fill": "#F2A0B5"},
      {"type": "ellipse", "c": [2.7, 2.95], "rx": 0.09, "ry": 0.13, "fill": "#2B2D42"},
      {"type": "circle", "c": [2.73, 2.9], "r": 0.03, "fill": "#F6F1E9"},
      {"type": "circle", "c": [2.3, 3.15], "r": 0.08, "fill": "#F2A0B5"},
      {"type": "path", "d": "M2.4,3.35 Q2.55,3.5 2.7,3.35", "stroke": "#2B2D42", "width": 0.04}
    ]
  },
  "provenance": {
    "author": "ai:claude",
    "reviewedByHuman": false
  }
}
