{
  "format": "tangram-puzzle/1",
  "id": "animals-fish",
  "title": {
    "en": "Fish",
    "fi": "Kala"
  },
  "category": "animals",
  "difficulty": 2,
  "kind": "full",
  "solution": [
    {"piece": "LT1", "polygon": [[2, 0], [2, 4], [0, 2]]},
    {"piece": "LT2", "polygon": [[7, 0], [7, 4], [5, 2]]},
    {"piece": "SQ", "polygon": [[2, 3], [3, 2], [4, 3], [3, 4]]},
    {"piece": "ST1", "polygon": [[3, 2], [5, 2], [4, 3]]},
    {"piece": "ST2", "polygon": [[6, 3], [4, 3], [5, 2]]},
    {"piece": "PG", "polygon": [[2, 3], [2, 1], [3, 0], [3, 2]]},
    {"piece": "MT", "polygon": [[3, 2], [3, 0], [5, 2]]}
  ],
  "art": {
    "base": "#F28C38",
    "shapes": [
      {"type": "polygon", "points": [[5, 2], [7, 0], [7, 4]], "fill": "#2A9D8F"},
      {"type": "polygon", "points": [[2, 2.6], [4.9, 2.6], [4.9, 3], [4, 3], [3, 4], [2, 3]], "fill": "#FFD9A8"},
      {"type": "polygon", "points": [[2, 3], [2, 1], [3, 0], [3, 2]], "fill": "#D9621E"},
      {"type": "polygon", "points": [[4.3, 1.3], [4.7, 1.7], [4.7, 3.0], [4.3, 3.0]], "fill": "#D9621E"},
      {"type": "line", "from": [5.4, 2.0], "to": [7, 2.0], "stroke": "#FFD9A8", "width": 0.07},
      {"type": "line", "from": [5.5, 1.7], "to": [6.5, 0.9], "stroke": "#FFD9A8", "width": 0.07},
      {"type": "line", "from": [5.5, 2.3], "to": [6.5, 3.1], "stroke": "#FFD9A8", "width": 0.07},
      {"type": "path", "d": "M1.7,1.2 Q1.35,2.0 1.7,2.8", "stroke": "#D9621E", "width": 0.08},
      {"type": "circle", "c": [0.95, 1.8], "r": 0.2, "fill": "#FFFFFF"},
      {"type": "circle", "c": [1.0, 1.8], "r": 0.1, "fill": "#2B2D42"},
      {"type": "path", "d": "M0.25,2.0 Q0.5,2.2 0.7,2.1", "stroke": "#2B2D42", "width": 0.05}
    ]
  },
  "provenance": {
    "author": "ai:claude",
    "reviewedByHuman": false
  }
}
