{
  "format": "tangram-puzzle/1",
  "id": "nature-mountain",
  "title": {
    "en": "Mountain",
    "fi": "Vuori"
  },
  "category": "nature",
  "difficulty": 4,
  "kind": "full",
  "solution": [
    {"piece": "LT1", "polygon": [[0, 4], [4, 4], [2, 2]]},
    {"piece": "LT2", "polygon": [[4, 4], [4, 0], [2, 2]]},
    {"piece": "ST1", "polygon": [[4, 0], [4, 2], [5, 1]]},
    {"piece": "SQ", "polygon": [[6, 2], [5, 1], [4, 2], [5, 3]]},
    {"piece": "MT", "polygon": [[4, 2], [4, 4], [6, 4]]},
    {"piece": "ST2", "polygon": [[6, 2], [5, 3], [7, 3]]},
    {"piece": "PG", "polygon": [[8, 4], [7, 3], [5, 3], [6, 4]]}
  ],
  "art": {
    "base": "#7A8796",
    "shapes": [
      {"type": "polygon", "points": [[4, 0], [8, 4], [4, 4]], "fill": "#667280"},
      {"type": "polygon", "points": [[4, 0], [2.5, 1.5], [3.1, 1.25], [3.6, 1.7], [4.1, 1.2], [4.7, 1.6], [5.2, 1.35], [5.5, 1.5]], "fill": "#E4ECF4"},
      {"type": "rect", "x": 0, "y": 3.25, "w": 8, "h": 0.8, "fill": "#2F7D4F"},
      {"type": "polygon", "points": [[0.9, 3.3], [1.25, 2.7], [1.6, 3.3]], "fill": "#2F7D4F"},
      {"type": "polygon", "points": [[1.7, 3.3], [2.05, 2.55], [2.4, 3.3]], "fill": "#276B43"},
      {"type": "polygon", "points": [[5.6, 3.3], [5.95, 2.6], [6.3, 3.3]], "fill": "#276B43"},
      {"type": "polygon", "points": [[6.4, 3.3], [6.75, 2.8], [7.1, 3.3]], "fill": "#2F7D4F"},
      {"type": "path", "d": "M3.6,4 Q4.4,3.2 3.9,2.6 Q3.5,2.1 4.1,1.7", "stroke": "#D9C49A", "width": 0.08}
    ]
  },
  "provenance": {
    "author": "ai:claude",
    "reviewedByHuman": false
  }
}
