{
  "format": "tangram-puzzle/1",
  "id": "vehicles-rocket",
  "title": {
    "en": "Rocket",
    "fi": "Raketti"
  },
  "category": "vehicles",
  "difficulty": 2,
  "kind": "full",
  "solution": [
    {"piece": "LT1", "polygon": [[2, 5], [2, 1], [4, 3]]},
    {"piece": "LT2", "polygon": [[1, 5], [5, 5], [3, 7]]},
    {"piece": "MT", "polygon": [[4, 5], [2, 5], [4, 3]]},
    {"piece": "PG", "polygon": [[3, 0], [3, 2], [4, 3], [4, 1]]},
    {"piece": "SQ", "polygon": [[4, 6], [5, 5], [6, 6], [5, 7]]},
    {"piece": "ST1", "polygon": [[2, 6], [0, 6], [1, 5]]},
    {"piece": "ST2", "polygon": [[3, 0], [3, 2], [2, 1]]}
  ],
  "art": {
    "base": "#F4F1EA",
    "shapes": [
      {"type": "polygon", "points": [[2, 1.9], [2, 1], [3, 0], [4, 1], [4, 1.9]], "fill": "#E8505B"},
      {"type": "circle", "c": [3, 3.1], "r": 0.72, "fill": "#2B2D42"},
      {"type": "circle", "c": [3, 3.1], "r": 0.55, "fill": "#5AA9E6"},
      {"type": "rect", "x": 2, "y": 4.2, "w": 2, "h": 0.4, "fill": "#E8505B"},
      {"type": "polygon", "points": [[1, 5], [5, 5], [3, 7]], "fill": "#F5A623"},
      {"type": "polygon", "points": [[2, 5], [4, 5], [3, 6.4]], "fill": "#FFD23F"},
      {"type": "polygon", "points": [[2, 6], [0, 6], [1, 5]], "fill": "#E8505B"},
      {"type": "polygon", "points": [[4, 6], [5, 5], [6, 6], [5, 7]], "fill": "#E8505B"}
    ]
  },
  "provenance": {
    "author": "ai:claude",
    "reviewedByHuman": false
  }
}
