{
  "format": "tangram-puzzle/1",
  "id": "things-key",
  "title": {
    "en": "Key",
    "fi": "Avain"
  },
  "category": "things",
  "difficulty": 3,
  "kind": "full",
  "solution": [
    {"piece": "LT1", "polygon": [[2, 0], [2, 4], [0, 2]]},
    {"piece": "LT2", "polygon": [[2, 4], [2, 0], [4, 2]]},
    {"piece": "MT", "polygon": [[9, 1], [9, 3], [7, 1]]},
    {"piece": "PG", "polygon": [[4, 2], [6, 2], [7, 1], [5, 1]]},
    {"piece": "SQ", "polygon": [[6, 2], [7, 1], [8, 2], [7, 3]]},
    {"piece": "ST1", "polygon": [[8, 4], [8, 2], [9, 3]]},
    {"piece": "ST2", "polygon": [[3, 1], [5, 1], [4, 2]]}
  ],
  "art": {
    "base": "#F2B632",
    "shapes": [
      {"type": "circle", "c": [2, 2], "r": 1.15, "fill": "#C98A12"},
      {"type": "circle", "c": [2, 2], "r": 0.7, "fill": "#3E7CB1"},
      {"type": "line", "from": [3.0, 1.45], "to": [9, 1.45], "stroke": "#C98A12", "width": 0.14},
      {"type": "line", "from": [3.6, 0.7], "to": [3.6, 2.3], "stroke": "#C98A12", "width": 0.14},
      {"type": "line", "from": [4.0, 0.7], "to": [4.0, 2.3], "stroke": "#C98A12", "width": 0.14},
      {"type": "polygon", "points": [[7.5, 1], [9, 1], [9, 1.9], [8.5, 1.9], [8.5, 1.5], [7.9, 1.5]], "fill": "#C98A12"},
      {"type": "polygon", "points": [[7.2, 2.0], [7.8, 2.0], [7.5, 2.6]], "fill": "#FFE08A"},
      {"type": "polygon", "points": [[8.2, 2.8], [8.8, 2.8], [8.5, 3.5]], "fill": "#C98A12"}
    ]
  },
  "provenance": {
    "author": "ai:claude",
    "reviewedByHuman": false
  }
}
