{
  "format": "tangram-puzzle/1",
  "id": "animals-bird",
  "title": {
    "en": "Bird",
    "fi": "Lintu"
  },
  "category": "animals",
  "difficulty": 3,
  "kind": "full",
  "solution": [
    {"piece": "LT1", "polygon": [[1, 1], [5, 1], [3, 3]]},
    {"piece": "LT2", "polygon": [[7, 3], [3, 3], [5, 1]]},
    {"piece": "SQ", "polygon": [[6, 2], [7, 1], [8, 2], [7, 3]]},
    {"piece": "ST1", "polygon": [[8, 0], [8, 2], [7, 1]]},
    {"piece": "ST2", "polygon": [[2, 2], [0, 2], [1, 1]]},
    {"piece": "PG", "polygon": [[3, 4], [5, 4], [6, 3], [4, 3]]},
    {"piece": "MT", "polygon": [[6, 0], [6, 2], [4, 0]]}
  ],
  "art": {
    "base": "#5AA9E6",
    "shapes": [
      {"type": "polygon", "points": [[3, 4], [5, 4], [6, 3], [4, 3]], "fill": "#F8EBC8"},
      {"type": "polygon", "points": [[2.3, 2.0], [3.0, 2.95], [3.7, 2.0]], "fill": "#F8EBC8"},
      {"type": "polygon", "points": [[3.5, 2.9], [5.0, 1.4], [6.5, 2.9]], "fill": "#2F6FB5"},
      {"type": "polygon", "points": [[4, 0], [6, 0], [6, 2]], "fill": "#2F6FB5"},
      {"type": "polygon", "points": [[6, 2], [7, 1], [8, 2], [7, 3]], "fill": "#2F6FB5"},
      {"type": "polygon", "points": [[8, 0], [8, 2], [7, 1]], "fill": "#2F6FB5"},
      {"type": "polygon", "points": [[0, 2], [1, 1], [2, 2]], "fill": "#F5A623"},
      {"type": "line", "from": [0.1, 1.9], "to": [1.9, 1.9], "stroke": "#2B2D42", "width": 0.04},
      {"type": "circle", "c": [2.3, 1.45], "r": 0.13, "fill": "#2B2D42"},
      {"type": "circle", "c": [2.34, 1.4], "r": 0.04, "fill": "#F8EBC8"},
      {"type": "line", "from": [4.4, 2.6], "to": [5.2, 1.8], "stroke": "#5AA9E6", "width": 0.07},
      {"type": "line", "from": [5.0, 2.6], "to": [5.8, 1.8], "stroke": "#5AA9E6", "width": 0.07}
    ]
  },
  "provenance": {
    "author": "ai:claude",
    "reviewedByHuman": false
  }
}
